{
  "schema": "https://interpretive-governance.org/schemas/judge-panel-declaration.schema.json",
  "type": "judge-panel-declaration",
  "version": "0.1.0-experimental",
  "judges": [
    {
      "id": "boundary-preservation-judge",
      "kind": "human",
      "criteria": [
        "Preserves non-equivalence.",
        "Does not infer causality from proximity.",
        "Does not convert consequence into guarantee."
      ]
    }
  ]
}
